{
  "$schema": "https://json-schema.org/draft/2020-12/schema",
  "$id": "https://docdd/report.schema.json",
  "title": "Отчёт прогона проверок",
  "description": "Кладётся в tests/reports/<дата>-<runner>.json. Производные данные: удаление не ломает формат.",

  "type": "object",
  "required": ["contract", "runner", "started_at", "verifications"],
  "additionalProperties": true,

  "properties": {
    "contract": { "const": "docdd.workspace/1" },
    "runner": { "type": "string" },
    "started_at": { "type": "string", "format": "date-time" },
    "total": { "type": "integer", "minimum": 0 },
    "failed": { "type": "integer", "minimum": 0 },
    "checked_by": { "type": "string", "description": "Ручная отметка: имя того, кто проверил." },
    "note": { "type": "string", "description": "Ручная отметка: что именно проверено (одна-две строки)." },
    "build": { "type": "string", "description": "Версия сборки или релиза, на котором шёл прогон (R-0062)." },
    "steps": {
      "type": "array",
      "description": "Ручная приёмка: результат по шагам проверки (R-0061).",
      "items": { "type": "object", "required": ["text", "state"], "properties": { "text": { "type": "string" }, "expected": { "type": "string" }, "state": { "enum": ["passed", "failed"] } } }
    },
    "verifications": {
      "type": "object",
      "description": "Идентификатор проверки → результат последнего прогона.",
      "propertyNames": { "pattern": "^V-[0-9]{4}$" },
      "additionalProperties": { "enum": ["passed", "failed", "skipped"] }
    }
  }
}
