{
  "contract": "docdd.workspace/1",
  "runner": "manual:architect",
  "started_at": "2026-10-21T17:11:14.190Z",
  "total": 1,
  "failed": 0,
  "checked_by": "Claude Sonnet 5.5 (агент), по поручению пользователя",
  "note": "Принято по указанию пользователя. Автоматические тесты по требованию зелёные; живая проверка в браузере выполнена агентами только частично (прервана по лимиту), остальное принято без неё.",
  "verifications": {
    "V-0057": "passed"
  }
}
