{
  "contract": "docdd.workspace/1",
  "runner": "manual:architect",
  "started_at": "2026-10-24T21:15:20.838Z",
  "total": 1,
  "failed": 0,
  "checked_by": "модель по поручению владельца",
  "note": "Временный проект (src/store.ts, src/server.ts, подтверждённая карта кода), изолированный сервер, настоящий Claude Code: запрос «как есть» дал черновик карты с 5 возможностями implemented со свидетельствами и 4 требования «как есть» (M-0002, R-0001…R-0004). Найдено и исправлено: шаблон не требовал key у каждой записи; проверка свидетельств спотыкалась о два свидетельства в строке и диапазон строк. Проект удалён.",
  "verifications": {
    "V-0078": "passed"
  }
}
