{
  "contract": "docdd.workspace/1",
  "runner": "manual:Админ (architect)",
  "started_at": "2026-10-24T18:59:47.475Z",
  "build": "agent-run-v2",
  "total": 1,
  "failed": 0,
  "checked_by": "live",
  "note": "Изолированный сервер со входом (DOCDD_AUTH=on), временный проект: «Запустить в работу» у задачи с исполнителем qa-bot — агент взял задачу в работу и перевёл на проверку своим аккаунтом (подпись «· агент» в журнале), замечание в обсуждении; попытка агента подтвердить требование отклонена (agent_document_approve); токеном отклонены правка текста, слияние и закрытие своей задачи.",
  "verifications": {
    "V-0100": "passed"
  }
}
