{
  "contract": "docdd.workspace/1",
  "runner": "manual:architect",
  "started_at": "2026-10-25T18:58:37.419Z",
  "total": 1,
  "failed": 0,
  "checked_by": "модель по поручению владельца",
  "note": "Вживую на копии videos: срок/осталось/факт на «Работе» и в карточке, фаза с прогнозом, «Аналитика», CSV и JSON, строка журнала со временем, task_overdue в check без падения",
  "steps": [
    {
      "text": "«Работа» и карточка задачи — видны срок, «просрочена» / «осталось N дней», факт и оценка.",
      "state": "passed"
    },
    {
      "text": "Фаза — срок и прогноз окончания.",
      "state": "passed"
    },
    {
      "text": "«Аналитика» — средние lead и cycle time по типам и ролям (человек и агент отдельно), время по статусам, точность",
      "state": "passed"
    },
    {
      "text": "Экспорт CSV и JSON открывается во внешней таблице, числа совпадают с экраном.",
      "state": "passed"
    },
    {
      "text": "Перевести задачу в работу — в журнале строка со временем.",
      "state": "passed"
    },
    {
      "text": "`npm run check` и «Обзор» показывают `task_overdue` у просроченной задачи; сборка не падает.",
      "expected": "Все шаги сходятся; старые строки журнала без времени не ломают расчёт.",
      "state": "passed"
    }
  ],
  "verifications": {
    "V-0109": "passed"
  }
}
