{
  "contract": "docdd.workspace/1",
  "runner": "manual:architect",
  "started_at": "2026-10-24T20:56:54.947Z",
  "total": 1,
  "failed": 0,
  "checked_by": "модель по поручению владельца",
  "note": "Вживую: шестерёнка в шапке открывает окно поверх экрана, вкладки «Поиск» (эмбеддинги, пересборка), «Модели» (провайдеры, ключи, маршруты), «Агенты», «Аккаунты и доступ»; адрес страницы не меняется",
  "verifications": {
    "V-0083": "passed"
  }
}
