{
  "contract": "docdd.workspace/1",
  "runner": "manual:Админ (architect)",
  "started_at": "2026-10-24T19:19:32.133Z",
  "build": "review-2026-10-24",
  "total": 2,
  "failed": 0,
  "checked_by": "live",
  "note": "V-0094 — изолированный сервер: без consent git-init отказывает и .git не появляется; с согласием — репозиторий с веткой main без коммитов, повтор ничего не делает; экран папки без формата предлагает git init и выбор шаблона; обучение на странице проекта показывается, «Пропустить» убирает его, после перезагрузки не возвращается. V-0096 — вектор M-0076 подтверждён и перечисляет все пять границ R-0096.",
  "verifications": {
    "V-0094": "passed",
    "V-0096": "passed"
  }
}
