{
  "contract": "docdd.workspace/1",
  "runner": "manual:architect",
  "started_at": "2026-10-24T19:42:16.770Z",
  "total": 1,
  "failed": 0,
  "checked_by": "владелец",
  "note": "Отмечено «Проверено» по указанию владельца в чате; строка и окно проверены вживую на этом репозитории, черновик карты заводится существующим POST /map/capability",
  "steps": [
    {
      "text": "Открыть «Стратегию» — видна строка «Отметки отстали от фактов» с числом отставших.",
      "state": "passed"
    },
    {
      "text": "«Отметить по фактам» — у первой возможности предложено «Реализовано», у второй «Частично», у каждой причина.",
      "state": "passed"
    },
    {
      "text": "Снять одну галочку, «Завести черновик» — заведена одна запись `map` в `draft` только с выбранными возможностями; отметки на экране пока прежние.",
      "state": "passed"
    },
    {
      "text": "Подтвердить черновик — предупреждения `capability_behind` по выбранным возможностям пропали, число в строке уменьшилось.",
      "expected": "Отметка меняется только подтверждением черновика; без отставших строки нет. Автотест: `behindProposals` предлагает отметку по проверкам.",
      "state": "passed"
    }
  ],
  "verifications": {
    "V-0107": "passed"
  }
}
