{
  "contract": "docdd.workspace/1",
  "runner": "vitest",
  "started_at": "2026-10-21T16:20:00Z",
  "total": 1787,
  "failed": 0,
  "verifications": {
    "V-0001": "passed",
    "V-0003": "passed",
    "V-0005": "passed",
    "V-0006": "passed",
    "V-0007": "passed",
    "V-0008": "passed",
    "V-0009": "passed",
    "V-0011": "passed",
    "V-0015": "passed",
    "V-0044": "passed",
    "V-0045": "passed",
    "V-0046": "passed",
    "V-0051": "passed",
    "V-0053": "passed",
    "V-0054": "passed",
    "V-0055": "passed",
    "V-0056": "passed",
    "V-0058": "passed",
    "V-0059": "passed",
    "V-0060": "passed",
    "V-0061": "passed",
    "V-0062": "passed",
    "V-0063": "passed",
    "V-0064": "passed",
    "V-0068": "passed",
    "V-0069": "passed",
    "V-0070": "passed",
    "V-0071": "passed",
    "V-0073": "passed"
  }
}
