{
  "contract": "docdd.workspace/1",
  "runner": "manual:architect",
  "started_at": "2026-10-26T12:51:23.946Z",
  "total": 1,
  "failed": 0,
  "checked_by": "модель по поручению владельца",
  "note": "Вживую на копии videos: R-0004 и задачи → бэклог с причиной и обратно без подтверждения; вкладка «Бэклог» с рекомендациями «Потом»; deferred.spec зелёный",
  "steps": [
    {
      "text": "Подтверждённое требование",
      "expected": "«В бэклог» с причиной: статус `deferred`, строка журнала, тело не изменилось. Черновик",
      "state": "passed"
    },
    {
      "text": "Задача из `backlog` и из `ready`",
      "expected": "`deferred`; из `in_progress` — отказ; обратно — в `backlog`.",
      "state": "passed"
    },
    {
      "text": "Отложенное не видно на «Задачах» и «Требованиях» (там число со ссылкой), не считается в готовности фаз, не даёт",
      "state": "passed"
    },
    {
      "text": "Вкладка «Бэклог» показывает отложенные требования, задачи и возможности с горизонтом «Потом»; пачка «В бэклог» и",
      "state": "passed"
    },
    {
      "text": "Ссылки на отложенную запись рабочие, поиск её находит.",
      "expected": "Все шаги сходятся; проверка проекта без новых ошибок; автотесты на переходы и исключение из правил зелёные.",
      "state": "passed"
    }
  ],
  "verifications": {
    "V-0112": "passed"
  }
}
