{
  "contract": "docdd.workspace/1",
  "runner": "manual:architect",
  "started_at": "2026-10-24T20:56:54.192Z",
  "total": 1,
  "failed": 0,
  "checked_by": "модель по поручению владельца",
  "note": "Вживую на этом репозитории: запрос «доска» — секция «Разделы консоли» с «Работа › Менеджер» отдельным цветом; запрос по тексту ADR находит docs/adr/0038-open-source-apache.md со ссылкой на просмотр файла; находятся разобранные заметки (docs/inbox/принятое) и документация docs/**",
  "verifications": {
    "V-0082": "passed"
  }
}
